{
 "schema": "csf-gap-analyst/4",
 "function": "PR",
 "round": 3,
 "categories": [
  {
   "categoryId": "PR.AA",
   "keyMessage": {
    "found": "Privileged and vendor paths need only a password, and no one reviews access, although staff VPN and single sign-on already work.",
    "closes": "Enforce MFA on administrator and vendor access to Criticality A systems, then run the first access review."
   },
   "whatWorksToday": "Staff use single sign-on, remote access runs through VPN with no exposed remote desktop, and administrators use separate accounts.",
   "strengths": [
    {
     "id": "STR-PR.AA-01",
     "type": "Foundation",
     "statement": "IT runs a working identity management practice that it demonstrated, a base for a formal joiner, mover, and leaver process.",
     "evidence": [
      "PR.AA-01",
      "NOTE:PR.AA-01"
     ]
    },
    {
     "id": "STR-PR.AA-02",
     "type": "Foundation",
     "statement": "IT documents identity proofing for new accounts, but the service desk does not verify identity before resets.",
     "evidence": [
      "PR.AA-02",
      "IAM-08"
     ]
    },
    {
     "id": "STR-PR.AA-03",
     "type": "Foundation",
     "statement": "Staff use single sign-on, and remote access runs through VPN with no remote desktop exposed to the internet.",
     "evidence": [
      "IAM-07",
      "NET-03"
     ]
    },
    {
     "id": "STR-PR.AA-05",
     "type": "Foundation",
     "statement": "Administrators use separate admin accounts and a written password standard exists, but administrator numbers are not limited.",
     "evidence": [
      "IAM-03",
      "IAM-07"
     ]
    }
   ],
   "gapFindings": [
    {
     "id": "GAP-PR.AA-01",
     "basis": "Observed",
     "confidence": null,
     "title": "Privileged and vendor access relies on passwords alone",
     "statement": "CMC controls who holds an account but not how it proves identity, so its most powerful access paths have the weakest protection.",
     "supportingFacts": [
      {
       "fact": "Administrators sign in to HIS, PACS, and Active Directory without multi-factor authentication (MFA).",
       "evidence": [
        "mfa:HIS",
        "mfa:PACS",
        "mfa:Active Directory and network core",
        "IAM-01"
       ]
      },
      {
       "fact": "Vendors connect to HIS and PACS through unattended remote tools.",
       "evidence": [
        "C7:HIS",
        "C7:PACS"
       ]
      },
      {
       "fact": "Microsoft 365 has MFA for administrators and remote access only.",
       "evidence": [
        "C4:Microsoft 365",
        "CLD-01"
       ]
      }
     ],
     "extent": {
      "confirmed": [
       "HIS",
       "PACS",
       "Active Directory and network core"
      ],
      "likely": [
       "LIS",
       "ERP",
       "Hospital website"
      ],
      "notChecked": "Systems outside the profiled seven were not checked"
     },
     "linkedSubcategories": [
      "PR.AA-03"
     ],
     "evidence": [
      "mfa:HIS",
      "mfa:PACS",
      "mfa:Active Directory and network core",
      "IAM-01",
      "C7:HIS",
      "C7:PACS",
      "C4:Microsoft 365",
      "CLD-01"
     ],
     "rootCause": [
      "Ownership",
      "Tooling"
     ],
     "consequence": "One stolen administrator or vendor password lets ransomware encrypt HIS and Active Directory, which tolerate under four hours of downtime.",
     "likelihood": {
      "value": 4,
      "anchor": "L4-a",
      "rationale": "MFA is absent on three Criticality A systems, vendor remote access is open, and a peer hospital suffered ransomware.",
      "evidence": [
       "mfa:HIS",
       "mfa:PACS",
       "mfa:Active Directory and network core"
      ]
     },
     "impact": {
      "ops": {
       "value": 5,
       "rationale": "Stolen privileged password stops or slows hospital operations."
      },
      "fin": {
       "value": 4,
       "rationale": "Stolen privileged password adds recovery cost and revenue loss."
      },
      "legal": {
       "value": 4,
       "rationale": "Stolen privileged password triggers reporting duties or regulator questions."
      },
      "rep": {
       "value": 4,
       "rationale": "Stolen privileged password damages patient and public trust."
      },
      "safety": {
       "value": 5,
       "rationale": "Stolen privileged password delays or disrupts patient care."
      },
      "data": {
       "value": 5,
       "rationale": "Stolen privileged password exposes sensitive health records."
      }
     },
     "responses": {
      "fix": [
       "IMP-PR.AA-01-01",
       "IMP-PR.AA-01-02"
      ],
      "find": [
       "IMP-PR.AA-01-03"
      ],
      "prevent": [
       "IMP-PR.AA-01-04"
      ],
      "exceptions": [
       "IMP-PR.AA-01-05"
      ],
      "validate": [
       "IMP-PR.AA-01-06"
      ],
      "sustain": [
       "IMP-PR.AA-01-07"
      ],
      "stageStatus": {
       "fix": "Required",
       "find": "Required",
       "prevent": "Required",
       "exceptions": "Required",
       "validate": "Required",
       "sustain": "Required"
      },
      "notApplicable": {}
     },
     "landscapeRefs": [
      "B2",
      "B5",
      "B7",
      "B10",
      "B12"
     ],
     "repeatFinding": {
      "value": false,
      "priorRef": null
     },
     "documents": [
      {
       "id": "PR-STD-001",
       "status": "Not verified"
      },
      {
       "id": "PR-STD-003",
       "status": "Not verified"
      },
      {
       "id": "PR-STD-002",
       "status": "Not verified"
      },
      {
       "id": "ID-REG-002",
       "status": "Not verified"
      }
     ],
     "documentGaps": [
      "MFA coverage review record"
     ]
    },
    {
     "id": "GAP-PR.AA-02",
     "basis": "Observed",
     "confidence": null,
     "title": "Access is not controlled across the account life cycle",
     "statement": "Access rights depend on individuals instead of a governed process, so no one limits, reviews, or removes access consistently.",
     "supportingFacts": [
      {
       "fact": "No access review ran on HIS, PACS, Microsoft 365, or Active Directory in the past 12 months.",
       "evidence": [
        "uar:HIS",
        "uar:PACS",
        "uar:Microsoft 365",
        "uar:Active Directory and network core"
       ]
      },
      {
       "fact": "PACS, Active Directory, and the website use shared or generic administrator accounts.",
       "evidence": [
        "C5:PACS",
        "C5:Active Directory and network core",
        "C5:Hospital website"
       ]
      },
      {
       "fact": "PACS accounts are created on request without approval.",
       "evidence": [
        "F2:PACS"
       ]
      },
      {
       "fact": "Server room access is only partly restricted and logged.",
       "evidence": [
        "PHY-01"
       ]
      }
     ],
     "extent": {
      "confirmed": [
       "HIS",
       "PACS",
       "Microsoft 365",
       "Active Directory and network core"
      ],
      "likely": [],
      "notChecked": "Criticality B systems were not sampled"
     },
     "linkedSubcategories": [
      "PR.AA-01",
      "PR.AA-02",
      "PR.AA-05",
      "PR.AA-06"
     ],
     "evidence": [
      "uar:HIS",
      "uar:PACS",
      "uar:Microsoft 365",
      "uar:Active Directory and network core",
      "C5:PACS",
      "C5:Active Directory and network core",
      "C5:Hospital website",
      "F2:PACS",
      "PHY-01"
     ],
     "rootCause": [
      "Ownership",
      "Capacity"
     ],
     "consequence": "Former staff or vendors keep access to patient data unnoticed, and a stolen shared account gives wide reach.",
     "likelihood": {
      "value": 3,
      "anchor": "L3-c",
      "rationale": "Process gap that needs a leaver or a compromised account before harm.",
      "evidence": [
       "uar:HIS",
       "uar:PACS",
       "uar:Microsoft 365"
      ]
     },
     "impact": {
      "ops": {
       "value": 3,
       "rationale": "Lingering access stops or slows hospital operations."
      },
      "fin": {
       "value": 3,
       "rationale": "Lingering access adds recovery cost and revenue loss."
      },
      "legal": {
       "value": 4,
       "rationale": "Lingering access triggers reporting duties or regulator questions."
      },
      "rep": {
       "value": 4,
       "rationale": "Lingering access damages patient and public trust."
      },
      "safety": {
       "value": 3,
       "rationale": "Lingering access delays or disrupts patient care."
      },
      "data": {
       "value": 5,
       "rationale": "Lingering access exposes sensitive health records."
      }
     },
     "responses": {
      "fix": [
       "IMP-PR.AA-02-01",
       "IMP-PR.AA-02-04"
      ],
      "find": [
       "IMP-PR.AA-02-02"
      ],
      "prevent": [
       "IMP-PR.AA-02-03"
      ],
      "exceptions": [],
      "validate": [
       "IMP-PR.AA-02-05"
      ],
      "sustain": [
       "IMP-PR.AA-02-06"
      ],
      "stageStatus": {
       "fix": "Required",
       "find": "Required",
       "prevent": "Required",
       "validate": "Required",
       "sustain": "Required",
       "exceptions": "Not applicable"
      },
      "notApplicable": {
       "exceptions": "No system is known to be unable to meet the control."
      }
     },
     "landscapeRefs": [
      "B5",
      "B10"
     ],
     "repeatFinding": {
      "value": false,
      "priorRef": null
     },
     "documents": [
      {
       "id": "PR-PRC-001",
       "status": "Not verified"
      },
      {
       "id": "PR-PRC-002",
       "status": "Not verified"
      },
      {
       "id": "PR-REC-001",
       "status": "Not verified"
      },
      {
       "id": "PR-PRC-003",
       "status": "Not verified"
      },
      {
       "id": "PR-FRM-004",
       "status": "Not verified"
      },
      {
       "id": "GV-FRM-003",
       "status": "Not verified"
      }
     ],
     "documentGaps": []
    }
   ],
   "observations": []
  },
  {
   "categoryId": "PR.AT",